{
  "profileVersion": 1,
  "name": "vsomeip",
  "isolation": "processSingleton",
  "features": ["discovery", "events", "methods", "reliable", "ordered", "deadlines", "cancellation", "subscriptionState", "health", "diagnostics"],
  "limits": {
    "maxPayloadSize": 1048560,
    "maxHistoryDepth": 1,
    "maxOutstandingOperations": 128,
    "maxEndpoints": 128
  }
}
