{
  "profileVersion": 1,
  "name": "iceoryx2",
  "isolation": "independent",
  "features": ["discovery", "events", "methods", "loans", "scatterGather", "reliable", "ordered", "deadlines", "cancellation"],
  "limits": {
    "maxPayloadSize": 16777216,
    "maxHistoryDepth": 1024,
    "maxOutstandingOperations": 1024,
    "maxEndpoints": 1024
  }
}
