{
  "profileVersion": 1,
  "name": "inproc",
  "isolation": "independent",
  "features": ["discovery", "events", "methods", "loans", "reliable", "ordered", "deadlines", "cancellation", "subscriptionState", "health", "diagnostics"],
  "limits": {
    "maxPayloadSize": 16777216,
    "maxHistoryDepth": 4096,
    "maxOutstandingOperations": 256,
    "maxEndpoints": 256
  }
}
